{
  "id": "meridian-fraud-triage",
  "title": "Meridian Bank — Fraud Alert Triage System",
  "level_required": 3,
  "context": {
    "organisation": {
      "name": "Meridian Bank",
      "type": "challenger_bank",
      "founded": 2019,
      "customers": 280000,
      "regulator": "FCA",
      "authorisation_status": "FCA authorised",
      "channel": "digital-only",
      "pci_dss_scope": true
    },
    "regulatory_context": "FCA Consumer Duty obligations require proactive fraud detection and timely alert triage. PCI-DSS applies to all card data handling. Hard regulatory deadline: 6 months.",
    "team_composition": {
      "developers": 5,
      "qa": 1,
      "ba": 1,
      "product_owner": 1
    }
  },
  "personas_active": ["product-owner-challenger", "risk-manager-tier1", "internal-auditor"],
  "sprints": [
    {
      "sprint_number": 1,
      "goal": "Establish backlog, agree Definition of Done, set up team agreements",
      "duration_days": 10,
      "initial_backlog": [
        { "id": "alert-queue", "title": "As a fraud analyst, I can view alert queue", "points": 8, "type": "regulatory", "description": "Paginated queue of incoming fraud alerts sorted by priority" },
        { "id": "action-alert", "title": "As a fraud analyst, I can action an alert", "points": 5, "type": "business", "description": "Review, disposition (confirm fraud / false positive), and close alerts" },
        { "id": "alert-logging", "title": "As a system, alerts are logged with timestamp", "points": 3, "type": "regulatory", "description": "Every alert receives an immutable timestamp at creation" },
        { "id": "alert-thresholds", "title": "As an admin, I can configure alert thresholds", "points": 5, "type": "business", "description": "Configuration UI for threshold parameters per alert type" },
        { "id": "case-notes", "title": "As a fraud analyst, I can add case notes", "points": 3, "type": "business", "description": "Free-text notes attached to each alert case" },
        { "id": "pci-masking", "title": "As a system, PCI-DSS card data is masked in alerts", "points": 8, "type": "regulatory", "description": "All PAN/cardholder data masked per PCI-DSS requirement 3.4" },
        { "id": "escalate-alert", "title": "As a fraud analyst, I can escalate alerts to senior review", "points": 3, "type": "business", "description": "Send alerts requiring senior judgement to designated reviewer" },
        { "id": "audit-log", "title": "As a system, all user actions are audit logged", "points": 5, "type": "regulatory", "description": "Every user action is logged with user ID, timestamp, and action detail" }
      ],
      "injected_events": [],
      "available_decisions": [
        {
          "id": "dod-choice",
          "trigger": "immediate",
          "title": "Define your Definition of Done",
          "description": "Your first decision as BA. What standard will the team hold itself to?",
          "options": [
            {
              "id": "dod-standard",
              "label": "Standard Agile DoD",
              "description": "Code complete, unit tests pass, peer reviewed, acceptance criteria met",
              "risk": "medium",
              "state_changes": {
                "dod_choice": "standard",
                "velocity_modifier": 1.0,
                "quality_modifier": 0.9,
                "regulatory_rigour": 0.5,
                "team_capacity_percentage": 100
              }
            },
            {
              "id": "dod-regulated",
              "label": "Regulated DoD",
              "description": "Standard DoD plus controls sign-off, security review, compliance checklist, evidence capture",
              "risk": "low",
              "state_changes": {
                "dod_choice": "regulated",
                "velocity_modifier": 0.85,
                "quality_modifier": 1.3,
                "regulatory_rigour": 1.5,
                "team_capacity_percentage": 95
              }
            },
            {
              "id": "dod-minimal",
              "label": "Minimal DoD",
              "description": "Code complete only. Move fast, fix later.",
              "risk": "high",
              "state_changes": {
                "dod_choice": "minimal",
                "velocity_modifier": 1.15,
                "quality_modifier": 0.6,
                "regulatory_rigour": 0.2,
                "team_capacity_percentage": 105
              }
            }
          ]
        }
      ],
      "scoring_rubric": {
        "criteria": [
          { "id": "dod_selected", "description": "Definition of Done was agreed", "weight": 1.0 }
        ],
        "max_score": 10,
        "pass_threshold": 5
      }
    },
    {
      "sprint_number": 2,
      "goal": "Deliver core alert viewing and actioning functionality",
      "duration_days": 12,
      "initial_backlog": [
        { "id": "alert-queue-delivery", "title": "Complete alert queue UI with sorting and filtering", "points": 6, "type": "regulatory", "description": "Production-ready alert queue with sort, filter, and pagination" },
        { "id": "action-alert-delivery", "title": "Complete alert actioning workflow", "points": 7, "type": "business", "description": "End-to-end alert disposition workflow with confirmation" }
      ],
      "injected_events": [
        {
          "trigger": "day",
          "trigger_value": 3,
          "event_type": "backlog_injection",
          "payload": {
            "type": "scope_expansion",
            "description": "Product Owner rewrites 3 stories with expanded scope",
            "changes": [
              {
                "story_id": "alert-queue",
                "new_title": "As a fraud analyst, I can view alert queue with reporting dashboard",
                "additional_points": 5,
                "detail": "PO added reporting dashboard requirements on top of alert queue"
              },
              {
                "story_id": "action-alert",
                "new_title": "As a fraud analyst, I can action alerts individually or in bulk",
                "additional_points": 4,
                "detail": "PO added bulk action capability to alert actioning"
              },
              {
                "story_id": "case-notes",
                "new_title": "As a fraud analyst, I can add case notes with analytics",
                "additional_points": 3,
                "detail": "PO added analytics tracking to case notes"
              }
            ],
            "total_additional_points": 12
          }
        }
      ],
      "available_decisions": [
        {
          "id": "scope-response",
          "trigger": "event",
          "trigger_event_type": "scope_expansion",
          "title": "How do you respond to the scope expansion?",
          "description": "The Product Owner has expanded 3 stories significantly. This adds 12 story points to the sprint.",
          "options": [
            {
              "id": "scope-accept",
              "label": "Accept all changes",
              "description": "Take on the full scope increase. The team will need to work overtime.",
              "risk": "high",
              "state_changes": {
                "scope_response": "accepted",
                "sprint_scope_creep": 12,
                "velocity_modifier": -0.1,
                "team_capacity_percentage": 110,
                "po_trust_modifier": 8
              }
            },
            {
              "id": "scope-negotiate",
              "label": "Negotiate partial scope",
              "description": "Accept the reporting dashboard but push back on bulk actions and analytics. Offer to schedule for sprint 3.",
              "risk": "medium",
              "state_changes": {
                "scope_response": "negotiated",
                "sprint_scope_creep": 5,
                "velocity_modifier": -0.03,
                "team_capacity_percentage": 100,
                "po_trust_modifier": 3
              }
            },
            {
              "id": "scope-reject",
              "label": "Reject all scope changes",
              "description": "Hold the original sprint commitment. All changes go to backlog for future prioritisation.",
              "risk": "low",
              "state_changes": {
                "scope_response": "rejected",
                "sprint_scope_creep": 0,
                "velocity_modifier": 0,
                "team_capacity_percentage": 100,
                "po_trust_modifier": -5
              }
            }
          ]
        }
      ],
      "scoring_rubric": {
        "criteria": [
          { "id": "backlog_delivered", "description": "Core stories delivered", "weight": 1.0 },
          { "id": "scope_managed", "description": "Scope changes managed appropriately", "weight": 0.8 }
        ],
        "max_score": 15,
        "pass_threshold": 8
      }
    },
    {
      "sprint_number": 3,
      "goal": "Deliver PCI-DSS compliance stories and establish audit trail",
      "duration_days": 14,
      "initial_backlog": [
        { "id": "pci-masking-delivery", "title": "Complete PCI-DSS card data masking", "points": 8, "type": "regulatory", "description": "Full PCI-DSS compliant card data masking across all alert views and logs" },
        { "id": "audit-log-delivery", "title": "Complete audit logging system", "points": 5, "type": "regulatory", "description": "Immutable audit log with user ID, timestamp, and action detail" },
        { "id": "alert-logging-delivery", "title": "Complete alert timestamp logging", "points": 3, "type": "regulatory", "description": "Automated timestamp logging on all alert lifecycle events" }
      ],
      "injected_events": [
        {
          "trigger": "day",
          "trigger_value": 1,
          "event_type": "persona_trigger",
          "payload": {
            "persona_id": "risk-manager-tier1",
            "condition": "dod_choice != regulated",
            "response_key": "dod_rejected",